Kod,Ders,Eğitmen,Gün,Saat,Bina,Kayıtlı,Kontenjan,Bölüm Sınırlaması,CRN,Dönem
BEN 102,Microbiology,Hatice Funda Karbancıoğlu Güler,Çarşamba,0830/1229,KMB / ---,9,40,"MBI, MCB",12397,2023 - 2024 Güz Dönemi
BEN 107,Art of Engineering,"Aynur Karakaş Karaağaç, Oğuz Haşlakoğlu, Yüksel Demir",Perşembe,1330/1629,MMB / 307,15,30,MBI,12391,2023 - 2024 Güz Dönemi
BEN 111,Intr. to Bioengineering,Melek Mümine Erol Taygun,Cuma,1400/1559,KMB / D205,15,30,MBI,12394,2023 - 2024 Güz Dönemi
BEN 321,Reac. Kin&Reac. Design in Bio.,Ahmet Sirkecioğlu,Salı,1330/1629,KMB / D105,9,40,MBI,12398,2023 - 2024 Güz Dönemi
BEN 323,Material Science,Faiz Muhaffel,Pazartesi,1430/1729,KMB / D105,9,40,MBI,12400,2023 - 2024 Güz Dönemi
BEN 335,Biosensors,Muhammet Kürşat Kazmanlı,Perşembe,1330/1629,KMB / D106,1,40,MBI,12402,2023 - 2024 Güz Dönemi
BEN 337,Biofuels and Bioenergy,Serdar Yaman,Salı,0930/1229,KMB / D205,9,40,MBI,12403,2023 - 2024 Güz Dönemi
BEN 352,Transp. Process in Bioengin.,"Melek Mümine Erol Taygun, Fatma Elif Genceli Güner",Pazartesi,0830/1129,KMB / D102,9,40,MBI,12404,2023 - 2024 Güz Dönemi
