Kod,Ders,Eğitmen,Gün,Saat,Bina,Kayıtlı,Kontenjan,Bölüm Sınırlaması,CRN,Dönem
TER 201,Termodinamik,"Ahmet Ergün Palaz, Oğuz Salim Söğüt",Salı,0930/1229,GDB,54,55,CEV CHZ DEN GEM ISL JEO KMM KOM KON PET,21742,2019 - 2020 Bahar Dönemi
TER 201,Termodinamik,Hanzade Açma,Perşembe,0830/1129,KMB,67,67,CEV CHZ DEN GEM ISL JEO KMM KOM KON PET,21392,2019 - 2020 Bahar Dönemi
TER 201,Termodinamik,Emin Fuad Kent,Perşembe,0830/1129,EEB,38,40,CEV CHZ DEN GEM ISL JEO KMM KOM KON PET,21143,2019 - 2020 Bahar Dönemi
TER 201E,Thermodynamics,Ayşegül Abuşoğlu,Çarşamba,1230/1529,MKB,137,145,CEV CEVE CHZ CHZE DEN DENE GEM GEME GEMK ISL ISLE JEF JEO JEOE KMM KMME KOM KOME KON KONE MAD PET PETE TEK TEKE,23266,2019 - 2020 Bahar Dönemi
TER 201E,Thermodynamics,Ayşe Erbil,Salı,1030/1329,INB,65,66,CEV CEVE CHZ CHZE DEN DENE GEM GEME GEMK ISL ISLE JEF JEO JEOE KMM KMME KOM KOME KON KONE MAD PET PETE TEKE,21391,2019 - 2020 Bahar Dönemi
TER 203,Termodinamik I,"Sadriye Oskay, Ayşegül Meriçboyu",Salı,1330/1629,KMB,9,35,KMM KMMM,21486,2019 - 2020 Bahar Dönemi
