Kod,Ders,Eğitmen,Gün,Saat,Bina,Kayıtlı,Kontenjan,Bölüm Sınırlaması,CRN,Dönem
ISL 114E,Engineering Ethics,Zeynep Erden Bayazıt,Çarşamba,0930/1129,MED / B35,9,40,"ISL, ISLE",21417,2022 - 2023 Bahar Dönemi
ISL 214E,Statistics II,Raziye Selim,Salı,1430/1729,MED / A31,110,110,"ISL, ISLE",21420,2022 - 2023 Bahar Dönemi
ISL 214E,Statistics II,Raziye Selim,Çarşamba,1130/1429,MED / A15,91,100,"ISL, ISLE",21421,2022 - 2023 Bahar Dönemi
ISL 224E,Cost Accounting,Oktay Taş,Pazartesi,0830/1129,---- / ----,114,105,"EFN, END, ENDE, ISL, ISLE",21423,2022 - 2023 Bahar Dönemi
ISL 233E,Microeconomics,İbrahim Öner Günçavdı,Pazartesi,1130/1429,MED / A31,89,90,"ISL, ISLE, MMD",21425,2022 - 2023 Bahar Dönemi
ISL 234E,Management and Organization,Zeynep Erden Bayazıt,Pazartesi,1430/1729,MED / A15,61,90,"ECNE, GID, GIDE, ISL, ISLE",21427,2022 - 2023 Bahar Dönemi
ISL 234E,Management and Organization,Zeynep Erden Bayazıt,Salı,1130/1429,INB / B103,87,90,"ECNE, GID, GIDE, ISL, ISLE",21428,2022 - 2023 Bahar Dönemi
ISL 244E,Macroeconomics,"İpek İlkkaracan Ajas, Derya Gültekin",Salı,1430/1729,KMB / D103,62,90,"ISL, ISLE, MMD",21429,2022 - 2023 Bahar Dönemi
ISL 244E,Macroeconomics,"İpek İlkkaracan Ajas, Derya Gültekin",Çarşamba,1130/1429,MED / A16,74,90,"ISL, ISLE, MMD",21430,2022 - 2023 Bahar Dönemi
ISL 333E,Finance,"Cumhur Enis Ekinci, Oktay Taş",Perşembe,0830/1129,MED / A16,65,90,"ISL, ISLE",21432,2022 - 2023 Bahar Dönemi
ISL 333E,Finance,"Kaya Tokmakçıoğlu, Ahmet Göncü",Perşembe,1130/1429,MED / A31,117,105,"ISL, ISLE",21433,2022 - 2023 Bahar Dönemi
ISL 343E,Management Information Syst.,Nihan Yıldırım,Perşembe,1430/1729,---- / ----,162,170,"ECNE, ISL, ISLE",21434,2022 - 2023 Bahar Dönemi
ISL 353E,Marketing,Adnan Veysel Ertemel,Pazartesi,0830/1129,INB / A305,125,155,"ECNE, ENTE, EUT, EUTE, ISL, ISLE",21435,2022 - 2023 Bahar Dönemi
ISL 354E,Managerial Decision Making,Tolga Kaya,Çarşamba,1130/1429,MED / A31,56,55,"ISL, ISLE",21436,2022 - 2023 Bahar Dönemi
ISL 360E,Quantitative Rsrch&DataAnlys.,Elif Karaosmanoğlu,Salı,1130/1529,UUB / BIL1,68,90,"ISL, ISLE",21437,2022 - 2023 Bahar Dönemi
ISL 360E,Quantitative Rsrch&DataAnlys.,Kemal Burç Ülengin,Salı,1430/1829,UUB / D-Z08,35,90,"ISL, ISLE",21438,2022 - 2023 Bahar Dönemi
ISL 363E,Human Resources Management,Nataliia Shmatko,Pazartesi,1430/1729,MED / A16,45,90,"ISL, ISLE",21439,2022 - 2023 Bahar Dönemi
ISL 364E,Business Law,"Çiçek Ersoy Kekevi, Özgür Öztürk",Cuma,0830/1129,MED / A33,136,165,"ECNE, EFN, ISL, ISLE, MMD",21440,2022 - 2023 Bahar Dönemi
ISL 374E,Management Eng. Design I,"Mehmet Erçek, Çiğdem Kaya Pazarbaşı",Perşembe,0830/1129,MED / A31,91,90,"ISL, ISLE",21441,2022 - 2023 Bahar Dönemi
ISL 374E,Management Eng. Design I,"Deniz Tunçalp, Çiğdem Kaya Pazarbaşı",Perşembe,1130/1429,MDB / A105,79,90,"ISL, ISLE",21442,2022 - 2023 Bahar Dönemi
ISL 384E,Production Planning&Control,Hatice Camgöz Akdağ,Salı,0830/1129,MED / A34,99,100,"ISL, ISLE",21443,2022 - 2023 Bahar Dönemi
ISL 384E,Production Planning&Control,Hür Bersam Bolat,Çarşamba,0830/1129,MED / A34,84,90,"ISL, ISLE",21444,2022 - 2023 Bahar Dönemi
ISL 432E,Simulation in Operations Mng.,Tuncay Özcan,Cuma,1400/1659,---- / ----,95,110,"ISL, ISLE",21446,2022 - 2023 Bahar Dönemi
ISL 433,İş Hukuku,Ulaş Baysal,Çarşamba,1330/1529,MED / A12,67,90,"ISL, ISLE",21447,2022 - 2023 Bahar Dönemi
ISL 435E,The World Economy at a Glance,İpek İlkkaracan Ajas,Perşembe,1130/1429,INB / A303,33,95,"ENTE, EUT, EUTE, ISL, ISLE, YZVE",21449,2022 - 2023 Bahar Dönemi
ISL 448E,Optimization Models & App.,Fuat Kosanoğlu,Salı,1130/1429,EEB / 4102,34,90,"ISL, ISLE",21451,2022 - 2023 Bahar Dönemi
ISL 452E,Financial Inst.&Portfolio Mng.,Cumhur Enis Ekinci,Pazartesi,1130/1429,INB / A103,38,50,"END, ENDE, ISL, ISLE",21452,2022 - 2023 Bahar Dönemi
ISL 478E,Entrepreneurship,Deniz Tunçalp,Salı,1430/1729,MED / B34,30,40,"AIN, BIO, BIOE, BLG, BLGE, BST, CAB, CEB, CEV, CEVE, CHZ, CHZE, DEN, DENE, ECNE, EFN, EHB, EHBE, ELE, ELH, ELK, ELKE, END, ENDE, ENTE, EUT, EUTE, FIZ, FIZE, GEM, GEME, GEMK, GEO, GEOE, GID, GIDE, ICM, IML, IMLE, INS, INSE, ISL, ISLE, JDF, JEF, JEFE, JEO, JEOE, KIM, KIME, KMM, KMME, KMP, KOM, KOME, MAD, MADE, MAK, MAKE, MAT, MATE, MET, METE, MIM, MIME, MTO, MTOE, MTR, MUT, MUZ, MUZE, MZT, PEM, PEME, PET, PETE, SBP, SBPE, SES, TEB, TEK, TEKE, TEL, THO, UCK, UCKE, UZB, UZBE, YZVE",21453,2022 - 2023 Bahar Dönemi
ISL 4901,İşletme Müh. Tasarım Projesi I,Hatice Camgöz Akdağ,----,/,MED / ---,0,500,ISL,21456,2022 - 2023 Bahar Dönemi
ISL 4901E,Manage. Engin. Design Proj. I,Hatice Camgöz Akdağ,----,/,MED / ---,13,500,"ISL, ISLE",21457,2022 - 2023 Bahar Dönemi
ISL 4902,İşletme Müh.Tasarım Projesi II,Hatice Camgöz Akdağ,----,/,MED / ---,7,500,ISL,21458,2022 - 2023 Bahar Dönemi
ISL 4902E,Manage. Engin. Design Proj.II,Hatice Camgöz Akdağ,----,/,MED / ---,129,500,"ISL, ISLE",21459,2022 - 2023 Bahar Dönemi
ISL 492,İşletme Müh. Tasarım Prj.,Hatice Camgöz Akdağ,----,/,MED / ---,4,500,ISL,21454,2022 - 2023 Bahar Dönemi
ISL 492E,Management Eng. Design Project,Hatice Camgöz Akdağ,----,/,MED / ---,0,500,"ISL, ISLE",21455,2022 - 2023 Bahar Dönemi
