Kod,Ders,Eğitmen,Gün,Saat,Bina,Kayıtlı,Kontenjan,Bölüm Sınırlaması,CRN,Dönem
TER 201,Termodinamik,Birgül Benli,Perşembe Cuma,0930/1229 1330/1629,MDB MDB,18,40,CEV CHZ DEN GEM ISL JEO KMM KOM KON PET,30309,2016 - 2017 Yaz Dönemi
TER 201,Termodinamik,Halil Saraçoğlu,Çarşamba Çarşamba,0930/1229 1330/1629,GDB GDB,22,30,CEV CHZ DEN GEM ISL JEO KMM KOM KON PET,30566,2016 - 2017 Yaz Dönemi
TER 201E,Thermodynamics,Birgül Benli,Perşembe Cuma,1330/1629 0930/1229,MDB MDB,40,40,CEV CEVE CHZ CHZE DEN DENE GEM GEME GEMK ISL ISLE JEO JEOE KMM KMME KOM KOME KON KONE PET PETE TEKE,30311,2016 - 2017 Yaz Dönemi
TER 205,Termodinamik I,Mesut Gür,Salı Perşembe,0930/1229 0930/1229,MKB MKB,29,40,MAK MAKM,30137,2016 - 2017 Yaz Dönemi
TER 206,Termodinamik II,Mesut Gür,Salı Perşembe,1430/1729 1330/1629,MKB MKB,40,40,MAK MAKM,30138,2016 - 2017 Yaz Dönemi
