Kod,Ders,Eğitmen,Gün,Saat,Bina,Kayıtlı,Kontenjan,Bölüm Sınırlaması,CRN,Dönem
MUK 202,Mukavemet II,Abdul Hayır,Pazartesi Salı Çarşamba,1400/1759 1400/1759 1330/1759,,31,30,FIZ INS,30348,2019 - 2020 Yaz Dönemi
MUK 202,Mukavemet II,Teoman Özer,Pazartesi Salı Çarşamba,0900/1259 0900/1259 0900/1329,,23,30,FIZ INS,30352,2019 - 2020 Yaz Dönemi
MUK 202E,Strength of Materials II,Osman Bulut,Salı Çarşamba Perşembe,1400/1759 1330/1759 1400/1759,,30,30,FIZ FIZE INS INSE,30486,2019 - 2020 Yaz Dönemi
MUK 203,Mukavemet I,Özgür Özgüç,Çarşamba,0930/1659,,33,35,DEN ELE ELH GEM GEMM JEO TEL UCK UZB,30251,2019 - 2020 Yaz Dönemi
MUK 203E,Strength of Materials I,Vedat Ziya Doğan,Salı Perşembe,1400/1759 1400/1729,,41,50,DEN DENE ELE ELH GEM GEME GEMK JEO JEOE TEL UCK UCKE UCKM UZB UZBE,30356,2019 - 2020 Yaz Dönemi
MUK 204E,Strength of Materials II,Özge Özdemir,Pazartesi Çarşamba,1400/1759 1400/1729,,44,44,DEN DENE GEM GEME GEMK UCK UCKE UCKM UZB UZBE,30357,2019 - 2020 Yaz Dönemi
